{
  "schema_version": "1.0",
  "configuration_version": "N2B1P_REPROVISION_RUNTIME_CONFIGURATION_V2",
  "status": "DRAFT_NOT_AUTHORIZED",
  "runtime_parent_ref": "TRACKED_HISTORICAL_N2B1P_RUNTIME_CONFIGURATION_V1",
  "work_root_ref": "TRACKED_HISTORICAL_N2B1P_WORK_ROOT_BOUNDARY",
  "runtime_boundary_configuration_ref": "approvals/n2b1p_runtime_configuration.json",
  "runtime_boundary_configuration_sha256": "f8d6a2779f85a2944d60b2a94ff99c392f45fe5adefbfead3441a3ce72fa682b",
  "runtime_boundary_configuration_unchanged": true,
  "snapshot_root": "NOT_APPLICABLE_N2B1P_SOURCE_ACCESS_FORBIDDEN",
  "cache_root_ref": "E_CLAUDE_ALLOW_DOWNLOAD/npi-n2b1p-cache-v2-20260929",
  "cache_root_identity": "c030b04ce53a7bff949061c81178474576db62502013468ca967c11a646b9b6f",
  "source_root_ref": "OWNER_TO_IDENTIFY_EXTERNAL_QUARANTINE_ROOT",
  "source_root_identity": "0000000000000000000000000000000000000000000000000000000000000000",
  "python_qualification_commit": "639a503fa3c04c5fcc8640d8bee372377f3953d1",
  "python_qualification_checkpoint_sha256": "4974afbb1a022fdba0ffe6647a9fcb549d18234b69c864b35c7a2896e84ab128",
  "cache_root_attestation_ref": "E_CLAUDE_ALLOW_DOWNLOAD/npi-c2c-evidence-20260929/n2b1p-route-b-cache-root-preprovision.txt",
  "cache_root_attestation_sha256": "3e3c76a87cee9bc359ab9d283555c28855d6c918aeab863c1a46302da14f203e",
  "cache_root_empty": true,
  "cache_root_non_reparse": true,
  "cache_root_outside_git": true,
  "cache_root_outside_runtime": true,
  "cache_root_outside_source": true,
  "cache_root_outside_quarantine": true,
  "configuration_digest": "e77d0c775a1b1c98cf0146fde5a702b555373dd7c9147b587ab5d0bad590a043"
}
